
Bus 001 Device 009: ID 2708:000a Audient Audient EVO16
Device Descriptor:
  bLength                18
  bDescriptorType         1
  bcdUSB               2.00
  bDeviceClass          239 Miscellaneous Device
  bDeviceSubClass         2 
  bDeviceProtocol         1 Interface Association
  bMaxPacketSize0        64
  idVendor           0x2708 
  idProduct          0x000a 
  bcdDevice            1.27
  iManufacturer           1 Audient
  iProduct                2 Audient EVO16
  iSerial                 0 
  bNumConfigurations      2
  Configuration Descriptor:
    bLength                 9
    bDescriptorType         2
    wTotalLength       0x02ea
    bNumInterfaces          4
    bConfigurationValue     1
    iConfiguration          3 Config
    bmAttributes         0xc0
      Self Powered
    MaxPower              500mA
    Interface Association:
      bLength                 8
      bDescriptorType        11
      bFirstInterface         0
      bInterfaceCount         3
      bFunctionClass          1 Audio
      bFunctionSubClass       0 
      bFunctionProtocol      32 
      iFunction               0 
    Interface Descriptor:
      bLength                 9
      bDescriptorType         4
      bInterfaceNumber        0
      bAlternateSetting       0
      bNumEndpoints           1
      bInterfaceClass         1 Audio
      bInterfaceSubClass      1 Control Device
      bInterfaceProtocol     32 
      iInterface              5 Audient EVO16
      AudioControl Interface Descriptor:
        bLength                 9
        bDescriptorType        36
        bDescriptorSubtype      1 (HEADER)
        bcdADC               2.00
        bCategory               8
        wTotalLength       0x0250
        bmControls           0x01
          Latency control Control (read-only)
      AudioControl Interface Descriptor:
        bLength                 8
        bDescriptorType        36
        bDescriptorSubtype     10 (CLOCK_SOURCE)
        bClockID               41
        bmAttributes            3 Internal programmable clock 
        bmControls           0x07
          Clock Frequency Control (read/write)
          Clock Validity Control (read-only)
        bAssocTerminal          0
        iClockSource            6 Audient Internal Clock
      AudioControl Interface Descriptor:
        bLength                 8
        bDescriptorType        36
        bDescriptorSubtype     10 (CLOCK_SOURCE)
        bClockID               44
        bmAttributes            0 External clock 
        bmControls           0x07
          Clock Frequency Control (read/write)
          Clock Validity Control (read-only)
        bAssocTerminal          0
        iClockSource            7 Audient Optical1 Clock
      AudioControl Interface Descriptor:
        bLength                 8
        bDescriptorType        36
        bDescriptorSubtype     10 (CLOCK_SOURCE)
        bClockID               45
        bmAttributes            0 External clock 
        bmControls           0x07
          Clock Frequency Control (read/write)
          Clock Validity Control (read-only)
        bAssocTerminal          0
        iClockSource            8 Audient Optical2 Clock
      AudioControl Interface Descriptor:
        bLength                10
        bDescriptorType        36
        bDescriptorSubtype     11 (CLOCK_SELECTOR)
        bClockID               40
        bNrInPins               3
        baCSourceID(0)         41
        baCSourceID(1)         44
        baCSourceID(2)         45
        bmControls           0x03
          Clock Selector Control (read/write)
        iClockSelector          9 Audient Clock Selector
      AudioControl Interface Descriptor:
        bLength                17
        bDescriptorType        36
        bDescriptorSubtype      2 (INPUT_TERMINAL)
        bTerminalID             2
        wTerminalType      0x0101 USB Streaming
        bAssocTerminal          0
        bCSourceID             40
        bNrChannels            24
        bmChannelConfig    0x00000000
        iChannelNames          12 Analogue 1
        bmControls         0x0010
          Overload Control (read-only)
        iTerminal              11 Audient EVO16 Inputs
      AudioControl Interface Descriptor:
        bLength               122
        bDescriptorType        36
        bDescriptorSubtype      6 (FEATURE_UNIT)
        bUnitID                10
        bSourceID              51
        bmaControls(0)    0x00000000
        bmaControls(1)    0x00000000
        bmaControls(2)    0x00000000
        bmaControls(3)    0x00000000
        bmaControls(4)    0x00000000
        bmaControls(5)    0x00000000
        bmaControls(6)    0x00000000
        bmaControls(7)    0x00000000
        bmaControls(8)    0x00000000
        bmaControls(9)    0x00000000
        bmaControls(10)    0x00000000
        bmaControls(11)    0x00000000
        bmaControls(12)    0x00000000
        bmaControls(13)    0x00000000
        bmaControls(14)    0x00000000
        bmaControls(15)    0x00000000
        bmaControls(16)    0x00000000
        bmaControls(17)    0x00000000
        bmaControls(18)    0x00000000
        bmaControls(19)    0x00000000
        bmaControls(20)    0x00000000
        bmaControls(21)    0x00000000
        bmaControls(22)    0x00000000
        bmaControls(23)    0x00000000
        bmaControls(24)    0x00000000
        bmaControls(25)    0x00000000
        bmaControls(26)    0x00000000
        bmaControls(27)    0x00000000
        bmaControls(28)    0x00000000
        iFeature                0 
      AudioControl Interface Descriptor:
        bLength                12
        bDescriptorType        36
        bDescriptorSubtype      3 (OUTPUT_TERMINAL)
        bTerminalID            20
        wTerminalType      0x0301 Speaker
        bAssocTerminal          0
        bSourceID              10
        bCSourceID             40
        bmControls         0x0010
          Overload Control (read-only)
        iTerminal               0 
      AudioControl Interface Descriptor:
        bLength                17
        bDescriptorType        36
        bDescriptorSubtype      2 (INPUT_TERMINAL)
        bTerminalID             1
        wTerminalType      0x0201 Microphone
        bAssocTerminal          0
        bCSourceID             40
        bNrChannels            24
        bmChannelConfig    0x00000000
        iChannelNames          36 Analogue 1
        bmControls         0x0010
          Overload Control (read-only)
        iTerminal               0 
      AudioControl Interface Descriptor:
        bLength                16
        bDescriptorType        36
        bDescriptorSubtype      9 (EXTENSION_UNIT)
        bUnitID                58
        wExtensionCode     0x0000
        bNrInPins               1
        baSourceID(0)           1
        bNrChannels            24
        bmChannelConfig    0x00000000
        iChannelNames         255 (error)
        bmControls           0x00
        iExtension              0 
      AudioControl Interface Descriptor:
        bLength                16
        bDescriptorType        36
        bDescriptorSubtype      9 (EXTENSION_UNIT)
        bUnitID                62
        wExtensionCode     0x0000
        bNrInPins               1
        baSourceID(0)           1
        bNrChannels             1
        bmChannelConfig    0x00000000
        iChannelNames           0 
        bmControls           0x00
        iExtension              0 
      AudioControl Interface Descriptor:
        bLength               106
        bDescriptorType        36
        bDescriptorSubtype      6 (FEATURE_UNIT)
        bUnitID                11
        bSourceID               1
        bmaControls(0)    0x00000000
        bmaControls(1)    0x03300000
          Input gain Control (read/write)
          Phase inverter Control (read/write)
        bmaControls(2)    0x03300000
          Input gain Control (read/write)
          Phase inverter Control (read/write)
        bmaControls(3)    0x03300000
          Input gain Control (read/write)
          Phase inverter Control (read/write)
        bmaControls(4)    0x03300000
          Input gain Control (read/write)
          Phase inverter Control (read/write)
        bmaControls(5)    0x03300000
          Input gain Control (read/write)
          Phase inverter Control (read/write)
        bmaControls(6)    0x03300000
          Input gain Control (read/write)
          Phase inverter Control (read/write)
        bmaControls(7)    0x03300000
          Input gain Control (read/write)
          Phase inverter Control (read/write)
        bmaControls(8)    0x03300000
          Input gain Control (read/write)
          Phase inverter Control (read/write)
        bmaControls(9)    0x03300000
          Input gain Control (read/write)
          Phase inverter Control (read/write)
        bmaControls(10)    0x03300000
          Input gain Control (read/write)
          Phase inverter Control (read/write)
        bmaControls(11)    0x03300000
          Input gain Control (read/write)
          Phase inverter Control (read/write)
        bmaControls(12)    0x03300000
          Input gain Control (read/write)
          Phase inverter Control (read/write)
        bmaControls(13)    0x03300000
          Input gain Control (read/write)
          Phase inverter Control (read/write)
        bmaControls(14)    0x03300000
          Input gain Control (read/write)
          Phase inverter Control (read/write)
        bmaControls(15)    0x03300000
          Input gain Control (read/write)
          Phase inverter Control (read/write)
        bmaControls(16)    0x03300000
          Input gain Control (read/write)
          Phase inverter Control (read/write)
        bmaControls(17)    0x03300000
          Input gain Control (read/write)
          Phase inverter Control (read/write)
        bmaControls(18)    0x03300000
          Input gain Control (read/write)
          Phase inverter Control (read/write)
        bmaControls(19)    0x03300000
          Input gain Control (read/write)
          Phase inverter Control (read/write)
        bmaControls(20)    0x03300000
          Input gain Control (read/write)
          Phase inverter Control (read/write)
        bmaControls(21)    0x03300000
          Input gain Control (read/write)
          Phase inverter Control (read/write)
        bmaControls(22)    0x03300000
          Input gain Control (read/write)
          Phase inverter Control (read/write)
        bmaControls(23)    0x03300000
          Input gain Control (read/write)
          Phase inverter Control (read/write)
        bmaControls(24)    0x03300000
          Input gain Control (read/write)
          Phase inverter Control (read/write)
        iFeature                0 
      AudioControl Interface Descriptor:
        bLength                12
        bDescriptorType        36
        bDescriptorSubtype      3 (OUTPUT_TERMINAL)
        bTerminalID            22
        wTerminalType      0x0101 USB Streaming
        bAssocTerminal          0
        bSourceID              52
        bCSourceID             40
        bmControls         0x0010
          Overload Control (read-only)
        iTerminal              10 Audient EVO16 Outputs
      AudioControl Interface Descriptor:
        bLength                21
        bDescriptorType        36
        bDescriptorSubtype      9 (EXTENSION_UNIT)
        bUnitID                52
        wExtensionCode     0x0000
        bNrInPins               6
        baSourceID(0)          11
        baSourceID(1)           2
        baSourceID(2)          12
        baSourceID(3)          13
        baSourceID(4)          55
        baSourceID(5)          54
        bNrChannels            24
        bmChannelConfig    0x00000000
        iChannelNames           0 
        bmControls           0x00
        iExtension              0 
      AudioControl Interface Descriptor:
        bLength                21
        bDescriptorType        36
        bDescriptorSubtype      9 (EXTENSION_UNIT)
        bUnitID                51
        wExtensionCode     0x0000
        bNrInPins               6
        baSourceID(0)          11
        baSourceID(1)           1
        baSourceID(2)          12
        baSourceID(3)          13
        baSourceID(4)          55
        baSourceID(5)          54
        bNrChannels            28
        bmChannelConfig    0x00000000
        iChannelNames           0 
        bmControls           0x00
        iExtension              0 
      AudioControl Interface Descriptor:
        bLength                17
        bDescriptorType        36
        bDescriptorSubtype      9 (EXTENSION_UNIT)
        bUnitID                50
        wExtensionCode     0x0000
        bNrInPins               2
        baSourceID(0)           2
        baSourceID(1)           1
        bNrChannels            34
        bmChannelConfig    0x00000000
        iChannelNames           0 
        bmControls           0x00
        iExtension              0 
      AudioControl Interface Descriptor:
        bLength                40
        bDescriptorType        36
        bDescriptorSubtype      4 (MIXER_UNIT)
        bUnitID                60
        bNrInPins               1
        baSourceID(0)          50
        bNrChannels             6
        bmChannelConfig    0x00000000
        iChannelNames           0 
        bmMixerControls(0)   0xff
        bmControls           0xff
          Cluster Control (read/write)
          Underflow Control (read/write)
          Overflow Control (read/write)
        iMixer                255 (error)
      Warning: Junk at end of descriptor (25 bytes):
        ff ff ff ff ff ff ff ff ff ff ff ff ff ff ff ff ff ff ff ff ff ff ff 00 00 
      AudioControl Interface Descriptor:
        bLength                34
        bDescriptorType        36
        bDescriptorSubtype      6 (FEATURE_UNIT)
        bUnitID                12
        bSourceID              60
        bmaControls(0)     0x00000000
        bmaControls(1)     0x00000000
        bmaControls(2)     0x00000000
        bmaControls(3)     0x00000000
        bmaControls(4)     0x00000000
        bmaControls(5)     0x00000000
        bmaControls(6)     0x00000000
        iFeature                0 
      AudioControl Interface Descriptor:
        bLength                31
        bDescriptorType        36
        bDescriptorSubtype      4 (MIXER_UNIT)
        bUnitID                61
        bNrInPins               1
        baSourceID(0)          50
        bNrChannels             4
        bmChannelConfig    0x00000000
        iChannelNames           0 
        bmMixerControls(0)   0xff
        bmControls           0xff
          Cluster Control (read/write)
          Underflow Control (read/write)
          Overflow Control (read/write)
        iMixer                255 (error)
      Warning: Junk at end of descriptor (16 bytes):
        ff ff ff ff ff ff ff ff ff ff ff ff ff ff 00 00 
      AudioControl Interface Descriptor:
        bLength                26
        bDescriptorType        36
        bDescriptorSubtype      6 (FEATURE_UNIT)
        bUnitID                13
        bSourceID              61
        bmaControls(0)     0x00000000
        bmaControls(1)     0x00000000
        bmaControls(2)     0x00000000
        bmaControls(3)     0x00000000
        bmaControls(4)     0x00000000
        iFeature                0 
      AudioControl Interface Descriptor:
        bLength                17
        bDescriptorType        36
        bDescriptorSubtype      9 (EXTENSION_UNIT)
        bUnitID                55
        wExtensionCode     0x0002
        bNrInPins               2
        baSourceID(0)          12
        baSourceID(1)          13
        bNrChannels             5
        bmChannelConfig    0x00000000
        iChannelNames           0 
        bmControls           0x00
        iExtension              0 
      AudioControl Interface Descriptor:
        bLength                17
        bDescriptorType        36
        bDescriptorSubtype      9 (EXTENSION_UNIT)
        bUnitID                54
        wExtensionCode     0x0001
        bNrInPins               2
        baSourceID(0)          12
        baSourceID(1)          13
        bNrChannels             6
        bmChannelConfig    0x00000000
        iChannelNames           0 
        bmControls           0x00
        iExtension              0 
      Endpoint Descriptor:
        bLength                 7
        bDescriptorType         5
        bEndpointAddress     0x82  EP 2 IN
        bmAttributes            3
          Transfer Type            Interrupt
          Synch Type               None
          Usage Type               Data
        wMaxPacketSize     0x0006  1x 6 bytes
        bInterval               8
    Interface Descriptor:
      bLength                 9
      bDescriptorType         4
      bInterfaceNumber        1
      bAlternateSetting       0
      bNumEndpoints           0
      bInterfaceClass         1 Audio
      bInterfaceSubClass      2 Streaming
      bInterfaceProtocol     32 
      iInterface              0 
    Interface Descriptor:
      bLength                 9
      bDescriptorType         4
      bInterfaceNumber        1
      bAlternateSetting       1
      bNumEndpoints           1
      bInterfaceClass         1 Audio
      bInterfaceSubClass      2 Streaming
      bInterfaceProtocol     32 
      iInterface              0 
      AudioStreaming Interface Descriptor:
        bLength                16
        bDescriptorType        36
        bDescriptorSubtype      1 (AS_GENERAL)
        bTerminalLink           2
        bmControls           0x00
        bFormatType             1
        bmFormats          0x00000001
          PCM
        bNrChannels            24
        bmChannelConfig    0x00000000
        iChannelNames          12 Analogue 1
      AudioStreaming Interface Descriptor:
        bLength                 6
        bDescriptorType        36
        bDescriptorSubtype      2 (FORMAT_TYPE)
        bFormatType             1 (FORMAT_TYPE_I)
        bSubslotSize            3
        bBitResolution         24
      Endpoint Descriptor:
        bLength                 7
        bDescriptorType         5
        bEndpointAddress     0x01  EP 1 OUT
        bmAttributes            5
          Transfer Type            Isochronous
          Synch Type               Asynchronous
          Usage Type               Data
        wMaxPacketSize     0x03a8  1x 936 bytes
        bInterval               1
        AudioStreaming Endpoint Descriptor:
          bLength                 8
          bDescriptorType        37
          bDescriptorSubtype      1 (EP_GENERAL)
          bmAttributes         0x00
          bmControls           0x00
          bLockDelayUnits         2 Decoded PCM samples
          wLockDelay         0x0008
    Interface Descriptor:
      bLength                 9
      bDescriptorType         4
      bInterfaceNumber        2
      bAlternateSetting       0
      bNumEndpoints           0
      bInterfaceClass         1 Audio
      bInterfaceSubClass      2 Streaming
      bInterfaceProtocol     32 
      iInterface              0 
    Interface Descriptor:
      bLength                 9
      bDescriptorType         4
      bInterfaceNumber        2
      bAlternateSetting       1
      bNumEndpoints           1
      bInterfaceClass         1 Audio
      bInterfaceSubClass      2 Streaming
      bInterfaceProtocol     32 
      iInterface              0 
      AudioStreaming Interface Descriptor:
        bLength                16
        bDescriptorType        36
        bDescriptorSubtype      1 (AS_GENERAL)
        bTerminalLink          22
        bmControls           0x00
        bFormatType             1
        bmFormats          0x00000001
          PCM
        bNrChannels            24
        bmChannelConfig    0x00000000
        iChannelNames          36 Analogue 1
      AudioStreaming Interface Descriptor:
        bLength                 6
        bDescriptorType        36
        bDescriptorSubtype      2 (FORMAT_TYPE)
        bFormatType             1 (FORMAT_TYPE_I)
        bSubslotSize            3
        bBitResolution         24
      Endpoint Descriptor:
        bLength                 7
        bDescriptorType         5
        bEndpointAddress     0x81  EP 1 IN
        bmAttributes           37
          Transfer Type            Isochronous
          Synch Type               Asynchronous
          Usage Type               Implicit feedback Data
        wMaxPacketSize     0x03a8  1x 936 bytes
        bInterval               1
        AudioStreaming Endpoint Descriptor:
          bLength                 8
          bDescriptorType        37
          bDescriptorSubtype      1 (EP_GENERAL)
          bmAttributes         0x00
          bmControls           0x00
          bLockDelayUnits         2 Decoded PCM samples
          wLockDelay         0x0008
    Interface Descriptor:
      bLength                 9
      bDescriptorType         4
      bInterfaceNumber        3
      bAlternateSetting       0
      bNumEndpoints           0
      bInterfaceClass       254 Application Specific Interface
      bInterfaceSubClass      1 Device Firmware Update
      bInterfaceProtocol      1 
      iInterface              4 DFU
      Device Firmware Upgrade Interface Descriptor:
        bLength                             9
        bDescriptorType                    33
        bmAttributes                        7
          Will Not Detach
          Manifestation Tolerant
          Upload Supported
          Download Supported
        wDetachTimeout                    250 milliseconds
        wTransferSize                      64 bytes
        bcdDFUVersion                   1.10
  Configuration Descriptor:
    bLength                 9
    bDescriptorType         2
    wTotalLength       0x02ea
    bNumInterfaces          4
    bConfigurationValue     1
    iConfiguration          3 Config
    bmAttributes         0xc0
      Self Powered
    MaxPower              500mA
    Interface Association:
      bLength                 8
      bDescriptorType        11
      bFirstInterface         0
      bInterfaceCount         3
      bFunctionClass          1 Audio
      bFunctionSubClass       0 
      bFunctionProtocol      32 
      iFunction               0 
    Interface Descriptor:
      bLength                 9
      bDescriptorType         4
      bInterfaceNumber        0
      bAlternateSetting       0
      bNumEndpoints           1
      bInterfaceClass         1 Audio
      bInterfaceSubClass      1 Control Device
      bInterfaceProtocol     32 
      iInterface              5 Audient EVO16
      AudioControl Interface Descriptor:
        bLength                 9
        bDescriptorType        36
        bDescriptorSubtype      1 (HEADER)
        bcdADC               2.00
        bCategory               8
        wTotalLength       0x0250
        bmControls           0x01
          Latency control Control (read-only)
      AudioControl Interface Descriptor:
        bLength                 8
        bDescriptorType        36
        bDescriptorSubtype     10 (CLOCK_SOURCE)
        bClockID               41
        bmAttributes            3 Internal programmable clock 
        bmControls           0x07
          Clock Frequency Control (read/write)
          Clock Validity Control (read-only)
        bAssocTerminal          0
        iClockSource            6 Audient Internal Clock
      AudioControl Interface Descriptor:
        bLength                 8
        bDescriptorType        36
        bDescriptorSubtype     10 (CLOCK_SOURCE)
        bClockID               44
        bmAttributes            0 External clock 
        bmControls           0x07
          Clock Frequency Control (read/write)
          Clock Validity Control (read-only)
        bAssocTerminal          0
        iClockSource            7 Audient Optical1 Clock
      AudioControl Interface Descriptor:
        bLength                 8
        bDescriptorType        36
        bDescriptorSubtype     10 (CLOCK_SOURCE)
        bClockID               45
        bmAttributes            0 External clock 
        bmControls           0x07
          Clock Frequency Control (read/write)
          Clock Validity Control (read-only)
        bAssocTerminal          0
        iClockSource            8 Audient Optical2 Clock
      AudioControl Interface Descriptor:
        bLength                10
        bDescriptorType        36
        bDescriptorSubtype     11 (CLOCK_SELECTOR)
        bClockID               40
        bNrInPins               3
        baCSourceID(0)         41
        baCSourceID(1)         44
        baCSourceID(2)         45
        bmControls           0x03
          Clock Selector Control (read/write)
        iClockSelector          9 Audient Clock Selector
      AudioControl Interface Descriptor:
        bLength                17
        bDescriptorType        36
        bDescriptorSubtype      2 (INPUT_TERMINAL)
        bTerminalID             2
        wTerminalType      0x0101 USB Streaming
        bAssocTerminal          0
        bCSourceID             40
        bNrChannels            24
        bmChannelConfig    0x00000000
        iChannelNames          12 Analogue 1
        bmControls         0x0010
          Overload Control (read-only)
        iTerminal              11 Audient EVO16 Inputs
      AudioControl Interface Descriptor:
        bLength               122
        bDescriptorType        36
        bDescriptorSubtype      6 (FEATURE_UNIT)
        bUnitID                10
        bSourceID              51
        bmaControls(0)    0x00000000
        bmaControls(1)    0x00000000
        bmaControls(2)    0x00000000
        bmaControls(3)    0x00000000
        bmaControls(4)    0x00000000
        bmaControls(5)    0x00000000
        bmaControls(6)    0x00000000
        bmaControls(7)    0x00000000
        bmaControls(8)    0x00000000
        bmaControls(9)    0x00000000
        bmaControls(10)    0x00000000
        bmaControls(11)    0x00000000
        bmaControls(12)    0x00000000
        bmaControls(13)    0x00000000
        bmaControls(14)    0x00000000
        bmaControls(15)    0x00000000
        bmaControls(16)    0x00000000
        bmaControls(17)    0x00000000
        bmaControls(18)    0x00000000
        bmaControls(19)    0x00000000
        bmaControls(20)    0x00000000
        bmaControls(21)    0x00000000
        bmaControls(22)    0x00000000
        bmaControls(23)    0x00000000
        bmaControls(24)    0x00000000
        bmaControls(25)    0x00000000
        bmaControls(26)    0x00000000
        bmaControls(27)    0x00000000
        bmaControls(28)    0x00000000
        iFeature                0 
      AudioControl Interface Descriptor:
        bLength                12
        bDescriptorType        36
        bDescriptorSubtype      3 (OUTPUT_TERMINAL)
        bTerminalID            20
        wTerminalType      0x0301 Speaker
        bAssocTerminal          0
        bSourceID              10
        bCSourceID             40
        bmControls         0x0010
          Overload Control (read-only)
        iTerminal               0 
      AudioControl Interface Descriptor:
        bLength                17
        bDescriptorType        36
        bDescriptorSubtype      2 (INPUT_TERMINAL)
        bTerminalID             1
        wTerminalType      0x0201 Microphone
        bAssocTerminal          0
        bCSourceID             40
        bNrChannels            24
        bmChannelConfig    0x00000000
        iChannelNames          36 Analogue 1
        bmControls         0x0010
          Overload Control (read-only)
        iTerminal               0 
      AudioControl Interface Descriptor:
        bLength                16
        bDescriptorType        36
        bDescriptorSubtype      9 (EXTENSION_UNIT)
        bUnitID                58
        wExtensionCode     0x0000
        bNrInPins               1
        baSourceID(0)           1
        bNrChannels            24
        bmChannelConfig    0x00000000
        iChannelNames         255 (error)
        bmControls           0x00
        iExtension              0 
      AudioControl Interface Descriptor:
        bLength                16
        bDescriptorType        36
        bDescriptorSubtype      9 (EXTENSION_UNIT)
        bUnitID                62
        wExtensionCode     0x0000
        bNrInPins               1
        baSourceID(0)           1
        bNrChannels             1
        bmChannelConfig    0x00000000
        iChannelNames           0 
        bmControls           0x00
        iExtension              0 
      AudioControl Interface Descriptor:
        bLength               106
        bDescriptorType        36
        bDescriptorSubtype      6 (FEATURE_UNIT)
        bUnitID                11
        bSourceID               1
        bmaControls(0)    0x00000000
        bmaControls(1)    0x03300000
          Input gain Control (read/write)
          Phase inverter Control (read/write)
        bmaControls(2)    0x03300000
          Input gain Control (read/write)
          Phase inverter Control (read/write)
        bmaControls(3)    0x03300000
          Input gain Control (read/write)
          Phase inverter Control (read/write)
        bmaControls(4)    0x03300000
          Input gain Control (read/write)
          Phase inverter Control (read/write)
        bmaControls(5)    0x03300000
          Input gain Control (read/write)
          Phase inverter Control (read/write)
        bmaControls(6)    0x03300000
          Input gain Control (read/write)
          Phase inverter Control (read/write)
        bmaControls(7)    0x03300000
          Input gain Control (read/write)
          Phase inverter Control (read/write)
        bmaControls(8)    0x03300000
          Input gain Control (read/write)
          Phase inverter Control (read/write)
        bmaControls(9)    0x03300000
          Input gain Control (read/write)
          Phase inverter Control (read/write)
        bmaControls(10)    0x03300000
          Input gain Control (read/write)
          Phase inverter Control (read/write)
        bmaControls(11)    0x03300000
          Input gain Control (read/write)
          Phase inverter Control (read/write)
        bmaControls(12)    0x03300000
          Input gain Control (read/write)
          Phase inverter Control (read/write)
        bmaControls(13)    0x03300000
          Input gain Control (read/write)
          Phase inverter Control (read/write)
        bmaControls(14)    0x03300000
          Input gain Control (read/write)
          Phase inverter Control (read/write)
        bmaControls(15)    0x03300000
          Input gain Control (read/write)
          Phase inverter Control (read/write)
        bmaControls(16)    0x03300000
          Input gain Control (read/write)
          Phase inverter Control (read/write)
        bmaControls(17)    0x03300000
          Input gain Control (read/write)
          Phase inverter Control (read/write)
        bmaControls(18)    0x03300000
          Input gain Control (read/write)
          Phase inverter Control (read/write)
        bmaControls(19)    0x03300000
          Input gain Control (read/write)
          Phase inverter Control (read/write)
        bmaControls(20)    0x03300000
          Input gain Control (read/write)
          Phase inverter Control (read/write)
        bmaControls(21)    0x03300000
          Input gain Control (read/write)
          Phase inverter Control (read/write)
        bmaControls(22)    0x03300000
          Input gain Control (read/write)
          Phase inverter Control (read/write)
        bmaControls(23)    0x03300000
          Input gain Control (read/write)
          Phase inverter Control (read/write)
        bmaControls(24)    0x03300000
          Input gain Control (read/write)
          Phase inverter Control (read/write)
        iFeature                0 
      AudioControl Interface Descriptor:
        bLength                12
        bDescriptorType        36
        bDescriptorSubtype      3 (OUTPUT_TERMINAL)
        bTerminalID            22
        wTerminalType      0x0101 USB Streaming
        bAssocTerminal          0
        bSourceID              52
        bCSourceID             40
        bmControls         0x0010
          Overload Control (read-only)
        iTerminal              10 Audient EVO16 Outputs
      AudioControl Interface Descriptor:
        bLength                21
        bDescriptorType        36
        bDescriptorSubtype      9 (EXTENSION_UNIT)
        bUnitID                52
        wExtensionCode     0x0000
        bNrInPins               6
        baSourceID(0)          11
        baSourceID(1)           2
        baSourceID(2)          12
        baSourceID(3)          13
        baSourceID(4)          55
        baSourceID(5)          54
        bNrChannels            24
        bmChannelConfig    0x00000000
        iChannelNames           0 
        bmControls           0x00
        iExtension              0 
      AudioControl Interface Descriptor:
        bLength                21
        bDescriptorType        36
        bDescriptorSubtype      9 (EXTENSION_UNIT)
        bUnitID                51
        wExtensionCode     0x0000
        bNrInPins               6
        baSourceID(0)          11
        baSourceID(1)           1
        baSourceID(2)          12
        baSourceID(3)          13
        baSourceID(4)          55
        baSourceID(5)          54
        bNrChannels            28
        bmChannelConfig    0x00000000
        iChannelNames           0 
        bmControls           0x00
        iExtension              0 
      AudioControl Interface Descriptor:
        bLength                17
        bDescriptorType        36
        bDescriptorSubtype      9 (EXTENSION_UNIT)
        bUnitID                50
        wExtensionCode     0x0000
        bNrInPins               2
        baSourceID(0)           2
        baSourceID(1)           1
        bNrChannels            34
        bmChannelConfig    0x00000000
        iChannelNames           0 
        bmControls           0x00
        iExtension              0 
      AudioControl Interface Descriptor:
        bLength                40
        bDescriptorType        36
        bDescriptorSubtype      4 (MIXER_UNIT)
        bUnitID                60
        bNrInPins               1
        baSourceID(0)          50
        bNrChannels             6
        bmChannelConfig    0x00000000
        iChannelNames           0 
        bmMixerControls(0)   0xff
        bmControls           0xff
          Cluster Control (read/write)
          Underflow Control (read/write)
          Overflow Control (read/write)
        iMixer                255 (error)
      Warning: Junk at end of descriptor (25 bytes):
        ff ff ff ff ff ff ff ff ff ff ff ff ff ff ff ff ff ff ff ff ff ff ff 00 00 
      AudioControl Interface Descriptor:
        bLength                34
        bDescriptorType        36
        bDescriptorSubtype      6 (FEATURE_UNIT)
        bUnitID                12
        bSourceID              60
        bmaControls(0)     0x00000000
        bmaControls(1)     0x00000000
        bmaControls(2)     0x00000000
        bmaControls(3)     0x00000000
        bmaControls(4)     0x00000000
        bmaControls(5)     0x00000000
        bmaControls(6)     0x00000000
        iFeature                0 
      AudioControl Interface Descriptor:
        bLength                31
        bDescriptorType        36
        bDescriptorSubtype      4 (MIXER_UNIT)
        bUnitID                61
        bNrInPins               1
        baSourceID(0)          50
        bNrChannels             4
        bmChannelConfig    0x00000000
        iChannelNames           0 
        bmMixerControls(0)   0xff
        bmControls           0xff
          Cluster Control (read/write)
          Underflow Control (read/write)
          Overflow Control (read/write)
        iMixer                255 (error)
      Warning: Junk at end of descriptor (16 bytes):
        ff ff ff ff ff ff ff ff ff ff ff ff ff ff 00 00 
      AudioControl Interface Descriptor:
        bLength                26
        bDescriptorType        36
        bDescriptorSubtype      6 (FEATURE_UNIT)
        bUnitID                13
        bSourceID              61
        bmaControls(0)     0x00000000
        bmaControls(1)     0x00000000
        bmaControls(2)     0x00000000
        bmaControls(3)     0x00000000
        bmaControls(4)     0x00000000
        iFeature                0 
      AudioControl Interface Descriptor:
        bLength                17
        bDescriptorType        36
        bDescriptorSubtype      9 (EXTENSION_UNIT)
        bUnitID                55
        wExtensionCode     0x0002
        bNrInPins               2
        baSourceID(0)          12
        baSourceID(1)          13
        bNrChannels             5
        bmChannelConfig    0x00000000
        iChannelNames           0 
        bmControls           0x00
        iExtension              0 
      AudioControl Interface Descriptor:
        bLength                17
        bDescriptorType        36
        bDescriptorSubtype      9 (EXTENSION_UNIT)
        bUnitID                54
        wExtensionCode     0x0001
        bNrInPins               2
        baSourceID(0)          12
        baSourceID(1)          13
        bNrChannels             6
        bmChannelConfig    0x00000000
        iChannelNames           0 
        bmControls           0x00
        iExtension              0 
      Endpoint Descriptor:
        bLength                 7
        bDescriptorType         5
        bEndpointAddress     0x82  EP 2 IN
        bmAttributes            3
          Transfer Type            Interrupt
          Synch Type               None
          Usage Type               Data
        wMaxPacketSize     0x0006  1x 6 bytes
        bInterval               8
    Interface Descriptor:
      bLength                 9
      bDescriptorType         4
      bInterfaceNumber        1
      bAlternateSetting       0
      bNumEndpoints           0
      bInterfaceClass         1 Audio
      bInterfaceSubClass      2 Streaming
      bInterfaceProtocol     32 
      iInterface              0 
    Interface Descriptor:
      bLength                 9
      bDescriptorType         4
      bInterfaceNumber        1
      bAlternateSetting       1
      bNumEndpoints           1
      bInterfaceClass         1 Audio
      bInterfaceSubClass      2 Streaming
      bInterfaceProtocol     32 
      iInterface              0 
      AudioStreaming Interface Descriptor:
        bLength                16
        bDescriptorType        36
        bDescriptorSubtype      1 (AS_GENERAL)
        bTerminalLink           2
        bmControls           0x00
        bFormatType             1
        bmFormats          0x00000001
          PCM
        bNrChannels            24
        bmChannelConfig    0x00000000
        iChannelNames          12 Analogue 1
      AudioStreaming Interface Descriptor:
        bLength                 6
        bDescriptorType        36
        bDescriptorSubtype      2 (FORMAT_TYPE)
        bFormatType             1 (FORMAT_TYPE_I)
        bSubslotSize            3
        bBitResolution         24
      Endpoint Descriptor:
        bLength                 7
        bDescriptorType         5
        bEndpointAddress     0x01  EP 1 OUT
        bmAttributes            5
          Transfer Type            Isochronous
          Synch Type               Asynchronous
          Usage Type               Data
        wMaxPacketSize     0x03a8  1x 936 bytes
        bInterval               1
        AudioStreaming Endpoint Descriptor:
          bLength                 8
          bDescriptorType        37
          bDescriptorSubtype      1 (EP_GENERAL)
          bmAttributes         0x00
          bmControls           0x00
          bLockDelayUnits         2 Decoded PCM samples
          wLockDelay         0x0008
    Interface Descriptor:
      bLength                 9
      bDescriptorType         4
      bInterfaceNumber        2
      bAlternateSetting       0
      bNumEndpoints           0
      bInterfaceClass         1 Audio
      bInterfaceSubClass      2 Streaming
      bInterfaceProtocol     32 
      iInterface              0 
    Interface Descriptor:
      bLength                 9
      bDescriptorType         4
      bInterfaceNumber        2
      bAlternateSetting       1
      bNumEndpoints           1
      bInterfaceClass         1 Audio
      bInterfaceSubClass      2 Streaming
      bInterfaceProtocol     32 
      iInterface              0 
      AudioStreaming Interface Descriptor:
        bLength                16
        bDescriptorType        36
        bDescriptorSubtype      1 (AS_GENERAL)
        bTerminalLink          22
        bmControls           0x00
        bFormatType             1
        bmFormats          0x00000001
          PCM
        bNrChannels            24
        bmChannelConfig    0x00000000
        iChannelNames          36 Analogue 1
      AudioStreaming Interface Descriptor:
        bLength                 6
        bDescriptorType        36
        bDescriptorSubtype      2 (FORMAT_TYPE)
        bFormatType             1 (FORMAT_TYPE_I)
        bSubslotSize            3
        bBitResolution         24
      Endpoint Descriptor:
        bLength                 7
        bDescriptorType         5
        bEndpointAddress     0x81  EP 1 IN
        bmAttributes           37
          Transfer Type            Isochronous
          Synch Type               Asynchronous
          Usage Type               Implicit feedback Data
        wMaxPacketSize     0x03a8  1x 936 bytes
        bInterval               1
        AudioStreaming Endpoint Descriptor:
          bLength                 8
          bDescriptorType        37
          bDescriptorSubtype      1 (EP_GENERAL)
          bmAttributes         0x00
          bmControls           0x00
          bLockDelayUnits         2 Decoded PCM samples
          wLockDelay         0x0008
    Interface Descriptor:
      bLength                 9
      bDescriptorType         4
      bInterfaceNumber        3
      bAlternateSetting       0
      bNumEndpoints           0
      bInterfaceClass       254 Application Specific Interface
      bInterfaceSubClass      1 Device Firmware Update
      bInterfaceProtocol      1 
      iInterface              4 DFU
      Device Firmware Upgrade Interface Descriptor:
        bLength                             9
        bDescriptorType                    33
        bmAttributes                        7
          Will Not Detach
          Manifestation Tolerant
          Upload Supported
          Download Supported
        wDetachTimeout                    250 milliseconds
        wTransferSize                      64 bytes
        bcdDFUVersion                   1.10
Device Qualifier (for other device speed):
  bLength                10
  bDescriptorType         6
  bcdUSB               2.00
  bDeviceClass          239 Miscellaneous Device
  bDeviceSubClass         2 
  bDeviceProtocol         1 Interface Association
  bMaxPacketSize0        64
  bNumConfigurations      2
Device Status:     0x0001
  Self Powered
